{
  "schemaVersion": "1",
  "reportKind": "sarif-multitool-normalized-baseline",
  "evaluation": {
    "repositoryCommitSha": "863210dfda02690b0d9ee579f5d7fd7a45545b1e",
    "sourceTreeSha256": "fa14cb54282345aa2cc16e4a931d79ba651282f4b3355dc09df51fa05212694f",
    "sarifRegressToolVersion": "0.1.0",
    "matcherAlgorithmVersion": "sarifregress/matcher/v3.1",
    "fingerprintAlgorithmVersions": [
      {
        "name": "derived-fingerprint",
        "version": "rule-path-context/v2"
      },
      {
        "name": "derived-fingerprint-compare",
        "version": "sarifregress/derived-fingerprint-compare/v2"
      },
      {
        "name": "embedded-snippet",
        "version": "embedded-snippet/v1"
      },
      {
        "name": "producer-fingerprint-common",
        "version": "sarifregress/producer-fingerprint-common-version/v1"
      }
    ],
    "outputSchemaVersion": "1",
    "configurationSchemaVersion": "1",
    "holdoutManifestSha256": "b9cf6325e2758889449aa021b5b45b3636e17a0dcf65d3c7dba215c2964fe379"
  },
  "tool": {
    "name": "Microsoft SARIF Multitool",
    "packageId": "Sarif.Multitool",
    "exactVersion": "5.5.0",
    "projectUrl": "https://github.com/microsoft/sarif-sdk",
    "sourceCommitSha": "e68c02f86ac02bb9acb3b9da6c3de2291d5b0e2a",
    "packageUrl": "https://api.nuget.org/v3-flatcontainer/sarif.multitool/5.5.0/sarif.multitool.5.5.0.nupkg",
    "packageSha256": "2d2c73cc1fa4b79e5a41bded05d94dd645fa61d003492054260d7e106e838149",
    "packageSizeBytes": 33705414,
    "license": "MIT",
    "helpOutputSha256": "48b649263a854b44a4a481485731029f8a4816e84a9a5cc408b74a161226112e",
    "versionOutputSha256": "13f929b87ef358f86355de31e3a8eddb5a745d7e37bae3924849b5e43acbf4f9"
  },
  "aggregate": {
    "groundTruthUnits": 99,
    "labelledRelationships": 75,
    "comparableRelationships": 72,
    "nonComparableRelationships": 3,
    "truePositives": 47,
    "falsePositives": 17,
    "falseNegatives": 25,
    "errors": 0,
    "unsupported": 0,
    "precision": 0.734375,
    "recall": 0.652778,
    "f1": 0.691177,
    "states": {
      "new": 17,
      "absent": 6,
      "unchanged": 39,
      "updated": 37,
      "error": 0,
      "unsupported": 0
    }
  },
  "producers": [
    {
      "producerId": "gitleaks",
      "metrics": {
        "groundTruthUnits": 33,
        "labelledRelationships": 25,
        "comparableRelationships": 24,
        "nonComparableRelationships": 1,
        "truePositives": 17,
        "falsePositives": 0,
        "falseNegatives": 7,
        "errors": 0,
        "unsupported": 0,
        "precision": 1,
        "recall": 0.708333,
        "f1": 0.829268,
        "states": {
          "new": 10,
          "absent": 3,
          "unchanged": 12,
          "updated": 8,
          "error": 0,
          "unsupported": 0
        }
      }
    },
    {
      "producerId": "pmd",
      "metrics": {
        "groundTruthUnits": 33,
        "labelledRelationships": 25,
        "comparableRelationships": 24,
        "nonComparableRelationships": 1,
        "truePositives": 11,
        "falsePositives": 14,
        "falseNegatives": 13,
        "errors": 0,
        "unsupported": 0,
        "precision": 0.44,
        "recall": 0.458333,
        "f1": 0.448979,
        "states": {
          "new": 2,
          "absent": 0,
          "unchanged": 15,
          "updated": 16,
          "error": 0,
          "unsupported": 0
        }
      }
    },
    {
      "producerId": "semgrep",
      "metrics": {
        "groundTruthUnits": 33,
        "labelledRelationships": 25,
        "comparableRelationships": 24,
        "nonComparableRelationships": 1,
        "truePositives": 19,
        "falsePositives": 3,
        "falseNegatives": 5,
        "errors": 0,
        "unsupported": 0,
        "precision": 0.863636,
        "recall": 0.791667,
        "f1": 0.826087,
        "states": {
          "new": 5,
          "absent": 3,
          "unchanged": 12,
          "updated": 13,
          "error": 0,
          "unsupported": 0
        }
      }
    }
  ],
  "cases": [
    {
      "caseId": "gitleaks",
      "producerId": "gitleaks",
      "inputHashes": {
        "baselineSarifSha256": "1a09b8b78e50c157ce16cdd3e21edffdeaec2deb88337c185d44f0fa5ff81a5c",
        "candidateSarifSha256": "57e66495752f67407be384eab0a6b2197abfde72df88921edbf8cc292e6f82f5",
        "labelsSha256": "1f17cc8e0eab4e94c70519817c42430a3344c42bd55c2ecd044d1d5f4b84b026",
        "notesSha256": "9bba156586dda36a00197623a04c80aba48d2de45165f0ad954f2c903bb5fb6d",
        "producerInputTreeSha256": "059fcfe68af567e7c97a746e4174afff67932532368973e40a3dc3d8f612fbf3",
        "configSha256": "68b03ba1cfa51168e345f90c25dc7390fcb706a4e7c83de7ae2334c0a5dea190"
      },
      "invocation": {
        "workingDirectory": ".",
        "executable": "sarif",
        "arguments": [
          "match-results-forward",
          "raw/multitool/gitleaks.instrumented-candidate.sarif",
          "--previous",
          "raw/multitool/gitleaks.instrumented-baseline.sarif",
          "--output-file-path",
          "raw/multitool/gitleaks.instrumented-output.sarif"
        ]
      },
      "rawArtifactRelativePath": "raw/multitool/gitleaks.instrumented-output.sarif",
      "instrumentationStateMultisetPreserved": true,
      "metrics": {
        "groundTruthUnits": 33,
        "labelledRelationships": 25,
        "comparableRelationships": 24,
        "nonComparableRelationships": 1,
        "truePositives": 17,
        "falsePositives": 0,
        "falseNegatives": 7,
        "errors": 0,
        "unsupported": 0,
        "precision": 1,
        "recall": 0.708333,
        "f1": 0.829268,
        "states": {
          "new": 10,
          "absent": 3,
          "unchanged": 12,
          "updated": 8,
          "error": 0,
          "unsupported": 0
        }
      },
      "relationshipResults": [
        {
          "relationshipId": "gitleaks-ambiguous-001",
          "groundTruth": {
            "kind": "ambiguous",
            "baselineKey": "baseline:0:0",
            "candidateKey": "candidate:0:0",
            "expectedClassification": "ambiguous"
          },
          "multitoolState": "unchanged",
          "taxonomyMapped": false,
          "mappedClassification": null,
          "comparable": false,
          "comparabilityReason": "multitool-does-not-express-ambiguity",
          "correct": null,
          "errorOrUnsupportedCode": null
        },
        {
          "relationshipId": "gitleaks-ambiguous-002",
          "groundTruth": {
            "kind": "ambiguous",
            "baselineKey": "baseline:0:1",
            "candidateKey": "candidate:0:1",
            "expectedClassification": "ambiguous"
          },
          "multitoolState": "unchanged",
          "taxonomyMapped": false,
          "mappedClassification": null,
          "comparable": false,
          "comparabilityReason": "multitool-does-not-express-ambiguity",
          "correct": null,
          "errorOrUnsupportedCode": null
        },
        {
          "relationshipId": "gitleaks-match-001",
          "groundTruth": {
            "kind": "match",
            "baselineKey": "baseline:0:10",
            "candidateKey": "candidate:0:10",
            "expectedClassification": "moved"
          },
          "multitoolState": "updated",
          "taxonomyMapped": false,
          "mappedClassification": null,
          "comparable": true,
          "comparabilityReason": "equivalent-state-semantics",
          "correct": true,
          "errorOrUnsupportedCode": null
        },
        {
          "relationshipId": "gitleaks-match-002",
          "groundTruth": {
            "kind": "match",
            "baselineKey": "baseline:0:11",
            "candidateKey": "candidate:0:11",
            "expectedClassification": "moved"
          },
          "multitoolState": "updated",
          "taxonomyMapped": false,
          "mappedClassification": null,
          "comparable": false,
          "comparabilityReason": "path-rebase-configuration-not-supported",
          "correct": null,
          "errorOrUnsupportedCode": null
        },
        {
          "relationshipId": "gitleaks-match-003",
          "groundTruth": {
            "kind": "match",
            "baselineKey": "baseline:0:12",
            "candidateKey": "candidate:0:12",
            "expectedClassification": "modified"
          },
          "multitoolState": "unchanged",
          "taxonomyMapped": true,
          "mappedClassification": "unchanged",
          "comparable": true,
          "comparabilityReason": "equivalent-state-semantics",
          "correct": true,
          "errorOrUnsupportedCode": null
        },
        {
          "relationshipId": "gitleaks-match-004",
          "groundTruth": {
            "kind": "match",
            "baselineKey": "baseline:0:13",
            "candidateKey": "candidate:0:13",
            "expectedClassification": "modified"
          },
          "multitoolState": "unchanged",
          "taxonomyMapped": true,
          "mappedClassification": "unchanged",
          "comparable": true,
          "comparabilityReason": "equivalent-state-semantics",
          "correct": true,
          "errorOrUnsupportedCode": null
        },
        {
          "relationshipId": "gitleaks-match-005",
          "groundTruth": {
            "kind": "match",
            "baselineKey": "baseline:0:14",
            "candidateKey": "candidate:0:14",
            "expectedClassification": "modified"
          },
          "multitoolState": "unchanged",
          "taxonomyMapped": true,
          "mappedClassification": "unchanged",
          "comparable": true,
          "comparabilityReason": "equivalent-state-semantics",
          "correct": true,
          "errorOrUnsupportedCode": null
        },
        {
          "relationshipId": "gitleaks-match-006",
          "groundTruth": {
            "kind": "match",
            "baselineKey": "baseline:0:15",